Image_name,ocr_text,caption
train0001.jpg,হরেক রকম চোর দিয়া বানাইছো মেলা. পিসি তোমার দরবারে এখন ৫Bl এর খেলা I Wiewiton dailyhunt ApD Store Goপgl Pluy |4411[1110,a poster with a man and woman in the background
train0002.jpg,বর যাত্রী যাওয়ার টাইমে যখব গাড়িতে জায়গা কম পড়ে ছোটরাঃ,a cat sitting on the back of a car
train0003.jpg,তুমিকেখা নাবলল বুকে অনেক ব্যখাহেয় TARLBAU; ঠিক মত পানি খাও এটা গ্যাস্রিকের ব্যথা,a girl talking on the phone with a man in the background
train0004.jpg,"যখন ভল্লুক এসে পড়ে এবং আপন এবং আপনার বেস্টফ়রেন্ড দুরজনের কেউই জানেন না কিভাবে গাছে চড়তে হয় 0, 0",a man laying on top of a bed next to another man
train0005.jpg,বন্ধুযখন তার গফকেকাজিন বলে পরিচয় দেয় [41#4 {C#I43} { @uঠe ৎemes সম্পর্কবদলে গেল একটি পলকে Jট:,a man playing guitar with another man
